<?xml version="1.0" encoding="UTF-8"?>
<!DOCTYPE simulation SYSTEM "simulation.dtd">
<simulation finalinst="100" initpop="10" maxpop="500" comfortsens="3"> 
   <grid colsnb="10" rowsnb="10"></grid> 
   <initialpoint xinitial="1" yinitial="1"/>
   <finalpoint xfinal="9" yfinal="9"/>
   <specialcostzones>
      <zone xinitial="2" yinitial="2" xfinal="3" yfinal="3">4</zone>
   </specialcostzones>
   <obstacles num="10">
      <obstacle xpos="4" ypos="1"/>
      <obstacle xpos="4" ypos="2"/>
      <obstacle xpos="4" ypos="3"/>
      <obstacle xpos="4" ypos="4"/>
      <obstacle xpos="1" ypos="4"/>
      <obstacle xpos="2" ypos="4"/>
      <obstacle xpos="2" ypos="5"/>
      <obstacle xpos="2" ypos="6"/>
      <obstacle xpos="3" ypos="6"/>
      <obstacle xpos="4" ypos="6"/>
   </obstacles>
   <events>
      <death param="10"/>
      <reproduction param="1"/>
      <move param="1"/>
   </events>
</simulation>
